[
  {
    "id": "SIM-OPS-001",
    "subject_id": "simulador-e2",
    "learning_objective": "K KNOWLEDGE – RNP: máximo recorte y punto aceptable",
    "stem": "¿Cuál es el máximo recorte aceptable en una aproximación RNP y cuál es el último punto al que puede vectorarse?",
    "options": [
      {
        "id": "A",
        "text": "Directo al MAPt en condiciones VMC.",
        "is_correct": false
      },
      {
        "id": "B",
        "text": "Nunca al FAF; el último punto aceptable es el IF con ángulo de interceptación máximo de 45º.",
        "is_correct": true
      },
      {
        "id": "C",
        "text": "Al punto entre IAF y FAF con ángulo < 90º.",
        "is_correct": false
      },
      {
        "id": "D",
        "text": "Directo al FAF si ángulo de interceptación < 30º.",
        "is_correct": false
      }
    ],
    "explanation": {
      "text": "En aproximaciones RNP:\n- **NUNCA** al **FAF**.\n- Último punto aceptable: **IF** con ángulo de interceptación máximo de **45º**.\n\n> 📖 **Extracto Literal del Manual — RemNote – K KNOWLEDGE (Pág. 33):**\n> \"Disconnect autothrottle in case of large amount of airsp variation. Change thrust setting only in case of unnaceptable airsp variation. Reengage autothrottle whenever possible. NOTE: – Do not extend flaps except for approach and landing – The FPA may be used to avoid large variations PITCH ATTITUDE. REVISION 20 NP1 QRH 6313-174\"\n\n![Recorte Oficial del Manual — RemNote – K KNOWLEDGE](./manual-crops/simulador-e2/SIM-OPS-001.png)",
      "references": [
        "RemNote – K KNOWLEDGE",
        "MOA/SOPM Binter"
      ]
    },
    "metadata": {}
  },
  {
    "id": "SIM-OPS-002",
    "subject_id": "simulador-e2",
    "learning_objective": "K KNOWLEDGE – FL410: limitación más restrictiva",
    "stem": "Al operar en FL410, ¿cuál es la limitación ambiental más restrictiva?",
    "options": [
      {
        "id": "A",
        "text": "VMO de 320 KIAS.",
        "is_correct": false
      },
      {
        "id": "B",
        "text": "Combustible remanente en tanque central.",
        "is_correct": false
      },
      {
        "id": "C",
        "text": "Temperatura: SAT -70ºC y TAT -54ºC.",
        "is_correct": true
      },
      {
        "id": "D",
        "text": "Presión diferencial máxima de cabina.",
        "is_correct": false
      }
    ],
    "explanation": {
      "text": "La limitación más restrictiva a FL410 es la **temperatura ambiental**: **SAT mínima de -70ºC** y **TAT mínima de -54ºC**.",
      "references": [
        "RemNote – K KNOWLEDGE",
        "MOA/SOPM Binter"
      ]
    },
    "metadata": {}
  },
  {
    "id": "SIM-OPS-003",
    "subject_id": "simulador-e2",
    "learning_objective": "K KNOWLEDGE – Procedimientos antirruido en Binter",
    "stem": "¿Cuáles son los dos procedimientos de reducción de ruido utilizados en Binter y sus alturas de reducción?",
    "options": [
      {
        "id": "A",
        "text": "NADP C con reducción a 500 ft AFE.",
        "is_correct": false
      },
      {
        "id": "B",
        "text": "NADP 1 (reducción a 800 ft AFE) y NADP 2 (reducción y aceleración a 800 ft AFE).",
        "is_correct": false
      },
      {
        "id": "C",
        "text": "NADP A (reducción de empuje a 1.500 ft AFE) y NADP B (reducción y aceleración a 1.000 ft AFE).",
        "is_correct": true
      },
      {
        "id": "D",
        "text": "NADP A y NADP B con reducción común a 3.000 ft AFE.",
        "is_correct": false
      }
    ],
    "explanation": {
      "text": "**Procedimientos antirruido Binter**:\n- **NADP A**: reducción de empuje a **1.500 ft AFE**.\n- **NADP B**: reducción de empuje y aceleración a **1.000 ft AFE**.\n\n> 📖 **Extracto Literal del Manual — RemNote – K KNOWLEDGE (Pág. 216):**\n> \"3-15-05 Page 10 ORIGINAL SOPM-1755-200 performed. NOTE: Some charts make reference to ICAO A or ICAO B procedures which are similar to NADP 1 and NADP 2 respectively. The characteristic difference between ICAO A and ICAO B, resides on he location of the noise relief area. The difference is maintained for NADP 1 and NADP 2. ICAO A and NADP 1 are procedures to protect areas located close to the airport. ICAO B and NADP 2 are procedures o protect areas located distant from the airport.\"\n\n![Recorte Oficial del Manual — RemNote – K KNOWLEDGE](./manual-crops/simulador-e2/SIM-OPS-003.png)",
      "references": [
        "RemNote – K KNOWLEDGE",
        "MOA/SOPM Binter"
      ]
    },
    "metadata": {}
  },
  {
    "id": "SIM-OPS-004",
    "subject_id": "simulador-e2",
    "learning_objective": "K KNOWLEDGE – Cold Soak Frost: causa y prevención",
    "stem": "¿Qué es el Cold Soak Frost y cómo se previene operativamente?",
    "options": [
      {
        "id": "A",
        "text": "Escarcha en el ala causada por combustible alar muy frío al contactar con aire húmedo; se previene no haciendo tankering para que el combustible de repostaje más cálido caliente la superficie alar.",
        "is_correct": true
      },
      {
        "id": "B",
        "text": "Escarcha en el estabilizador horizontal; se previene con deshielo antes del despegue.",
        "is_correct": false
      },
      {
        "id": "C",
        "text": "Hielo en los motores por descenso desde alta altitud; se previene con antihielo ALL.",
        "is_correct": false
      },
      {
        "id": "D",
        "text": "Congelación del combustible en el tanque central; se previene con calentadores de combustible.",
        "is_correct": false
      }
    ],
    "explanation": {
      "text": "**Cold Soak Frost**: escarcha formada en las alas porque el combustible alar muy frío (descenso desde altas altitudes) causa que la humedad ambiente se congele al contactar con la superficie.\n\n**Prevención**: No realizar *fuel tankering*; el combustible repostado en destino (más cálido) calienta la superficie alar desde el interior y elimina la escarcha.\n\n> 📖 **Extracto Literal del Manual — RemNote – K KNOWLEDGE (Pág. 25):**\n> \"ICING CONDITIONS, COLD WEATHER AND CO SOAK OPERATIONS SUPPLEMENTARY NORMAL CHECKLIST FOR IC CONDITIONS, COLD WEATHER AND COLD SO OPERATIONS. POWER UP Batteries Temperature............................ MIN -20°C (-4°F) If APU start is required: APU Area.............................................. CLEAR OF ICE OR SNOW Normal Power Up Procedure................. ACCOMPLISH NOTE: When OAT is below -20°C (-4°F) after a parking pe under cold soak condition, wait at least 15 minute accomplish the EM...\"\n\n![Recorte Oficial del Manual — RemNote – K KNOWLEDGE](./manual-crops/simulador-e2/SIM-OPS-004.png)",
      "references": [
        "RemNote – K KNOWLEDGE",
        "MOA/SOPM Binter"
      ]
    },
    "metadata": {}
  }
]