[
  {
    "id": "MOA-87-001",
    "subject_id": "command-upgrade",
    "learning_objective": "Conocer qué tipos de vuelo considera Binter como operaciones no comerciales (MOA 8.7)",
    "stem": "¿Cuál de los siguientes vuelos se clasificaría como operación no comercial según el MOA 8.7?",
    "options": [
      {
        "id": "A",
        "text": "Vuelo de línea regular con carga en bodega",
        "is_correct": false
      },
      {
        "id": "B",
        "text": "Vuelo chárter con pasajeros de pago",
        "is_correct": false
      },
      {
        "id": "C",
        "text": "Vuelo con un grupo de viajeros con acuerdo de código compartido",
        "is_correct": false
      },
      {
        "id": "D",
        "text": "Vuelo de posicionamiento (ferry) sin pasajeros ni carga comercial",
        "is_correct": true
      }
    ],
    "explanation": {
      "text": "Las **operaciones no comerciales** incluyen vuelos de posicionamiento (ferry), vuelos de prueba, vuelos de demostración sin fin comercial, etc. El MOA 8.7 regula los requisitos aplicables a estos vuelos.",
      "references": [
        "MOA Binter ED06 RN26, sección 8.7"
      ]
    },
    "metadata": {
      "difficulty": 0.55
    }
  },
  {
    "id": "MOA-88-001",
    "subject_id": "command-upgrade",
    "learning_objective": "Conocer los requisitos de oxígeno para tripulación de vuelo por encima de FL250 (MOA 8.8)",
    "stem": "¿A partir de qué altitud (presión de cabina) debe tener disponible oxígeno suplementario al menos un piloto?",
    "options": [
      {
        "id": "A",
        "text": "Por encima de FL250 de altitud barométrica",
        "is_correct": false
      },
      {
        "id": "B",
        "text": "Solo si hay solo un piloto en cabina",
        "is_correct": false
      },
      {
        "id": "C",
        "text": "Por encima de 10.000 ft de altitud de cabina en todo momento",
        "is_correct": true
      },
      {
        "id": "D",
        "text": "Solo en vuelo sobre FL410",
        "is_correct": false
      }
    ],
    "explanation": {
      "text": "La normativa (CAT.OP.MPA.195) requiere oxígeno suplementario para la tripulación de vuelo cuando la **altitud de presión de cabina supera los 10.000 ft**.",
      "references": [
        "MOA Binter ED06 RN26, sección 8.8; CAT.OP.MPA.195"
      ]
    },
    "metadata": {
      "difficulty": 0.6
    }
  },
  {
    "id": "MOA-88-002",
    "subject_id": "command-upgrade",
    "learning_objective": "Conocer los requisitos de oxígeno en caso de descompresión (MOA 8.8)",
    "stem": "Tras una descompresión de cabina que requiere descenso de emergencia, ¿cuál es la dotación de oxígeno mínima requerida para los pasajeros?",
    "options": [
      {
        "id": "A",
        "text": "No es necesaria la provisión de oxígeno para pasajeros si el descenso es rápido",
        "is_correct": false
      },
      {
        "id": "B",
        "text": "Solo para los pasajeros en asientos de salida de emergencia",
        "is_correct": false
      },
      {
        "id": "C",
        "text": "Suficiente para todos los pasajeros durante el tiempo que la altitud de cabina exceda 10.000 ft, y al menos 10 minutos para el 10% de los pasajeros a altitudes entre 10.000–13.000 ft",
        "is_correct": true
      },
      {
        "id": "D",
        "text": "Solo para vuelos sobre FL410",
        "is_correct": false
      }
    ],
    "explanation": {
      "text": "La normativa establece reservas de oxígeno para pasajeros en caso de descompresión: suficiente para **todos los pasajeros** durante el tiempo que la altitud de cabina exceda 10.000 ft, con dotaciones mínimas adicionales para distintos rangos de altitud.",
      "references": [
        "MOA Binter ED06 RN26, sección 8.8; CAT.OP.MPA.195"
      ]
    },
    "metadata": {
      "difficulty": 0.65
    }
  }
]