[
  {
    "id": "C172N-CHK-001",
    "subject_id": "fleet-c172n",
    "learning_objective": "Fallo de motor inmediatamente tras el despegue (Engine Failure Immediately After Takeoff)",
    "stem": "Según la lista de verificación de emergencias del C172N, ¿cuál es la acción inmediata si el motor falla inmediatamente tras el despegue con pista remanente insuficiente?",
    "options": [
      {
        "id": "A",
        "text": "Efectuar un viraje escarpado de 180° para regresar a la pista de despegue",
        "is_correct": false
      },
      {
        "id": "B",
        "text": "Extender flaps al máximo inmediatamente a cualquier velocidad",
        "is_correct": false
      },
      {
        "id": "C",
        "text": "Airspeed 65 KIAS (flaps UP) / 60 KIAS (flaps DOWN), Mezcla CORTADA, Válvula de combustible OFF, Contactos OFF",
        "is_correct": true
      },
      {
        "id": "D",
        "text": "Bombear la palanca de gases repetidamente y mantener el morro alto",
        "is_correct": false
      }
    ],
    "explanation": {
      "text": "Regla de oro de aviación y checklist C172N: **mantener velocidad de planeo (65/60 KIAS)**, aterrizar recto al frente evitando virajes pronunciados, y cortar mezcla, combustible y contactos eléctricos antes del impacto.\n\n> 📖 **Extracto Literal del Manual — Cessna 172N Pilot's Operating Handbook / Checklist de Emergencias (Pág. 7):**\n> \"3. Xponder 4. Luces estroboscópicas SBY Off Q) PARADA DE MOTOR ITEM ACCIÓN 1. Frenos de parking 2. Gases 3. Radios e Interruptores de aviónica 4. Luces excepto anticolisión 5. Mezcla 6. Rotativo anticolisión 7. Magnetos 8. Master 9. Mandos de vuelo 10. Calzos 11. Funda de pitot 12. Anclajes Poner Ajustar 1000 rpm Off Off Cortar Off Off Off Asegurar Poner Poner A requerimiento 1.1 INSPECCIÓN PREVUELO\"\n\n![Recorte Oficial del Manual — Cessna 172N Pilot's Operating Handbook / Checklist de Emergencias](./manual-crops/fleet-c172n/C172N-CHK-001.png)",
      "references": [
        "Cessna 172N Pilot's Operating Handbook / Checklist de Emergencias"
      ]
    },
    "metadata": {
      "difficulty": 0.55
    }
  },
  {
    "id": "C172N-CHK-002",
    "subject_id": "fleet-c172n",
    "learning_objective": "Fuego de motor durante la puesta en marcha en tierra (Engine Fire During Start)",
    "stem": "Si se produce fuego en el motor durante el arranque con motor que no llega a arrancar en el C172N, ¿cuál es el procedimiento?",
    "options": [
      {
        "id": "A",
        "text": "Conectar la bomba auxiliar de combustible",
        "is_correct": false
      },
      {
        "id": "B",
        "text": "Continuar accionando el motor de arranque para aspirar las llamas al motor; si no arranca: Mezcla CORTADA, Gases a fondo, Combustible OFF",
        "is_correct": true
      },
      {
        "id": "C",
        "text": "Cortar el arranque inmediatamente y abandonar la cabina con el motor en marcha",
        "is_correct": false
      },
      {
        "id": "D",
        "text": "Poner la palanca de gases al ralentí y cebar más combustible",
        "is_correct": false
      }
    ],
    "explanation": {
      "text": "El procedimiento del POH indica **seguir accionando la marcha (cranking)** para aspirar el combustible encendido hacia los cilindros; si el fuego no se extingue en unos segundos: Mezcla Idle Cut-off, Throttle Full Open, Fuel Shutoff Valve OFF y evacuar con extintor.\n\n> 📖 **Extracto Literal del Manual — Cessna 172N Pilot's Operating Handbook Sección 3 (Pág. 52):**\n> \"4) Hacer girar el motor mediante ignición. 5) Si persiste el fuego ABANDONAR EL AVION. 6) Utilizar extintores. Si después del arranque. 1) Continuar motor en marcha. El sistema de inducción tenderá a absorber el fuego. 2) Si tras 10 (DIEZ) segundos el fuego persiste: a) Selector fuel                = OFF. b) Mezcla = CORTAR. 3) ABANDONAR EL AVION. 4) Utilizar extintores.\"\n\n![Recorte Oficial del Manual — Cessna 172N Pilot's Operating Handbook Sección 3](./manual-crops/fleet-c172n/C172N-CHK-002.png)",
      "references": [
        "Cessna 172N Pilot's Operating Handbook Sección 3"
      ]
    },
    "metadata": {
      "difficulty": 0.6
    }
  },
  {
    "id": "C172N-CHK-003",
    "subject_id": "fleet-c172n",
    "learning_objective": "Sobrecarga del alternador / Luz de bajo voltaje (Overvoltage / Low Voltage)",
    "stem": "Si se enciende la luz de LOW VOLTAGE o el amperímetro muestra sobrecarga en el C172N en vuelo, ¿cuál es el procedimiento inicial?",
    "options": [
      {
        "id": "A",
        "text": "Alternator Switch OFF, desconectar equipos eléctricos no esenciales y aterrizar lo antes posible",
        "is_correct": true
      },
      {
        "id": "B",
        "text": "Master Switch en ON permanente y encender todas las luces exteriores",
        "is_correct": false
      },
      {
        "id": "C",
        "text": "Aumentar la potencia al máximo para que el alternador genere más tensión",
        "is_correct": false
      },
      {
        "id": "D",
        "text": "Cortar la mezcla para reiniciar el regulador de voltaje",
        "is_correct": false
      }
    ],
    "explanation": {
      "text": "Ante un fallo o sobretensión del alternador: desconectar el interruptor del alternador (**ALT OFF**) para proteger la aviónica y reducir la carga eléctrica para conservar la batería hasta el aterrizaje.\n\n> 📖 **Extracto Literal del Manual — Cessna 172N Pilot's Operating Handbook Sección 3 (Pág. 19):**\n> \"Los virajes de barrido se efectuarán siempre antes de iniciar cualquiera de las maniobras siguientes : − Vuelo lento. − Aproximaciones a pérdida. − Pérdidas. Si se van a realizar una serie de maniobras (entendiéndose por serie, un enlace consecutivo de ejercicios en el área de maniobras) se podrá ejecutar un sólo ciclo de virajes de barrido para ejecutar estas, no eximiendo este de la obligación de mantener una vigilancia exterior continua. El Objetivo es asegurarnos de que no tenemos tráfico...\"\n\n![Recorte Oficial del Manual — Cessna 172N Pilot's Operating Handbook Sección 3](./manual-crops/fleet-c172n/C172N-CHK-003.png)",
      "references": [
        "Cessna 172N Pilot's Operating Handbook Sección 3"
      ]
    },
    "metadata": {
      "difficulty": 0.55
    }
  },
  {
    "id": "C172N-POH-001",
    "subject_id": "fleet-c172n",
    "learning_objective": "Velocidades de despegue y mejor régimen de ascenso (Vy)",
    "stem": "¿Cuál es la velocidad de mejor régimen de ascenso (Vy) al nivel del mar para el Cessna 172N?",
    "options": [
      {
        "id": "A",
        "text": "65 KIAS",
        "is_correct": false
      },
      {
        "id": "B",
        "text": "59 KIAS (Vx - mejor ángulo)",
        "is_correct": false
      },
      {
        "id": "C",
        "text": "73 KIAS",
        "is_correct": true
      },
      {
        "id": "D",
        "text": "85 KIAS",
        "is_correct": false
      }
    ],
    "explanation": {
      "text": "Para el Cessna 172N (Lycoming O-320-H2AD, 160 HP), **Vy = 73 KIAS** al nivel del mar y **Vx = 59 KIAS**.\n\n> 📖 **Extracto Literal del Manual — Cessna 172N Pilot's Operating Handbook Sección 4 (Pág. 27):**\n> \"MANIOBRAS 1 1 27 2) Cuando la velocidad se aproxime a 60 Kts, aplicar potencia y posición de morro para establecer velocidad de mejor ángulo de ascenso. 3) Una vez establecida la actitud de mejor ángulo de ascenso, establecer una nueva actitud de morro alto incrementando la posición de mandos hacia atrás. 4) Cuando el avión empiece a vibrar, recuperar (manteniendo potencia y reduciendo el ángulo de ataque). 5) Recuperar de nuevo la velocidad de mejor ángulo el ascenso y mantener ascenso hasta...\"\n\n![Recorte Oficial del Manual — Cessna 172N Pilot's Operating Handbook Sección 4](./manual-crops/fleet-c172n/C172N-POH-001.png)",
      "references": [
        "Cessna 172N Pilot's Operating Handbook Sección 4"
      ]
    },
    "metadata": {
      "difficulty": 0.5
    }
  }
]