[
  {
    "id": "MOA-12-001",
    "subject_id": "command-upgrade",
    "learning_objective": "Procedimiento de fallo de comunicaciones en condiciones IFR (SERA.8035)",
    "stem": "Según MOA 12.3 y el Reglamento SERA, si se experimenta fallo de comunicaciones en vuelo IFR en condiciones meteorológicas de vuelo por instrumentos (IMC), ¿qué velocidad y nivel deben mantenerse?",
    "options": [
      {
        "id": "A",
        "text": "El nivel y velocidad asignados en la última autorización ATC durante 20 minutos tras la hora de notificación obligatoria, ajustando después al plan de vuelo",
        "is_correct": true
      },
      {
        "id": "B",
        "text": "Ascenso inmediato al nivel máximo de crucero disponible",
        "is_correct": false
      },
      {
        "id": "C",
        "text": "Aterrizaje en el aeropuerto más cercano en menos de 5 minutos",
        "is_correct": false
      },
      {
        "id": "D",
        "text": "Descenso inmediato al nivel del mar manteniendo rumbo actual",
        "is_correct": false
      }
    ],
    "explanation": {
      "text": "En espacio aéreo controlado bajo IMC, se mantiene el último nivel y velocidad asignados durante **20 minutos** tras el fallo/último reporte, y posteriormente se continúa conforme al plan de vuelo presentado.\n\n> 📖 **Extracto Literal del Manual — MOA Binter ED06 RN26, Sección 12.3; SERA.8035 (Pág. 90):**\n> \"G 6 Gest ó ocu e ta MGNT 17 - Entrenamiento D-3 MGNT 28 - FDM A-2 MGNT 30 – Data Link A-12.3 R-MGNT-01.024 - Arrendamiento de Aeronaves y Acuerdos Código Compartido A-13.1 / A-13.2 R-MGNT-16.014 - Control revisiones documentación del sistema A-0.2 / A-2.1 /A-2.3 R-MGNT-16.021 – Revisión de documentación - Avión A-8.1 R-MGNT-14.026 – Listado de Supervisores de Personal A-1.3 DC-MGNT-17.004 – Relación de Instructores D-1 / D-3.1 IT-MGNT-14.001 Evaluación de Competencia del personal A-2.1 R-MGNT...\"\n\n![Recorte Oficial del Manual — MOA Binter ED06 RN26, Sección 12.3; SERA.8035](./manual-crops/command-upgrade/MOA-12-001.png)",
      "references": [
        "MOA Binter ED06 RN26, Sección 12.3; SERA.8035"
      ]
    },
    "metadata": {
      "difficulty": 0.65
    }
  },
  {
    "id": "MOA-12-002",
    "subject_id": "command-upgrade",
    "learning_objective": "Instrucciones en caso de interceptación por aeronaves militares",
    "stem": "Según MOA 12.4, si una aeronave de Binter es interceptada por aviones militares, ¿cuál debe ser la primera acción de la tripulación?",
    "options": [
      {
        "id": "A",
        "text": "Acelerar a VMO para alejarse de la zona",
        "is_correct": false
      },
      {
        "id": "B",
        "text": "Efectuar maniobras evasivas a máxima potencia",
        "is_correct": false
      },
      {
        "id": "C",
        "text": "Apagar el transponder y todas las luces exteriores",
        "is_correct": false
      },
      {
        "id": "D",
        "text": "Seguir inmediatamente las instrucciones de la aeronave interceptora, responder a las señales visuales y sintonizar 121.500 MHz",
        "is_correct": true
      }
    ],
    "explanation": {
      "text": "El procedimiento universal de interceptación (MOA 12.4 / OACI Anexo 2) exige **seguir las instrucciones de la aeronave interceptora**, ajustar transponder 7700 si no hay otra instrucción, y establecer contacto en **121.500 MHz**.\n\n> 📖 **Extracto Literal del Manual — MOA Binter ED06 RN26, Sección 12.4; OACI Anexo 2; SERA.11015 (Pág. 448):**\n> \"asignado, por lo que podría ser obsoleto. Por favor, verifique el gestor documental para asegurarse de que está usando la versión vigente. 8.1.12.4 DOCUMENTACIÓN DE LOS TRIPULANTES Cada miembro de la Tripulación llevará en cada vuelo: • Manifiesto de Tripulaciones (si se requiere); • Licencias de vuelo o certificados en vigor con las anotaciones de las habilitaciones necesarias para realizar sus funciones; • Pasaporte (con el visado cuando proceda);\"\n\n![Recorte Oficial del Manual — MOA Binter ED06 RN26, Sección 12.4; OACI Anexo 2; SERA.11015](./manual-crops/command-upgrade/MOA-12-002.png)",
      "references": [
        "MOA Binter ED06 RN26, Sección 12.4; OACI Anexo 2; SERA.11015"
      ]
    },
    "metadata": {
      "difficulty": 0.55
    }
  },
  {
    "id": "MOA-12-003",
    "subject_id": "command-upgrade",
    "learning_objective": "Mínimos VMC en espacio aéreo Clase C, D y E por debajo de FL100",
    "stem": "Según MOA 12.1 y SERA.5001, ¿cuáles son las distancias mínimas a nubes requeridas para vuelo VFR por debajo de 10.000 ft (o 3.050 m) AMSL en espacio Clase C, D y E?",
    "options": [
      {
        "id": "A",
        "text": "300 m horizontalmente y 500 ft verticalmente",
        "is_correct": false
      },
      {
        "id": "B",
        "text": "8 km de visibilidad y 2.000 ft vertical de separación",
        "is_correct": false
      },
      {
        "id": "C",
        "text": "1.500 m horizontalmente y 1.000 ft (300 m) verticalmente, con 5 km de visibilidad en vuelo",
        "is_correct": true
      },
      {
        "id": "D",
        "text": "Libre de nubes y a la vista del suelo sin distancia mínima",
        "is_correct": false
      }
    ],
    "explanation": {
      "text": "Los mínimos de visibilidad y distancia a nubes VMC estándar por debajo de 10.000 ft en espacio controlado son **5 km de visibilidad, 1.500 m horizontal y 1.000 ft (300 m) vertical** de separación con nubes.\n\n> 📖 **Extracto Literal del Manual — MOA Binter ED06 RN26, Sección 12.1; SERA.5001 Tabla S5-1 (Pág. 6):**\n> \"Total folios: 4 ( 4 de 4 ) - Códi Este documento puede ser ve CID: AESAPIPAAOC000DF5B4A2348E Al mismo tiempo se le comunica que contra este acto, que no pone fin a la vía administrativa, los interesados pueden interponer, en los supuestos indicados en el artículo 112.1 y de conformidad con los artículos 121 y 122 de la Ley 39/2015, de 1 de octubre, del Procedimiento Administrativo Común de las Administraciones Públicas, recurso de alzada ante la Directora de la Agencia Estatal de Seguridad Aé...\"\n\n![Recorte Oficial del Manual — MOA Binter ED06 RN26, Sección 12.1; SERA.5001 Tabla S5-1](./manual-crops/command-upgrade/MOA-12-003.png)",
      "references": [
        "MOA Binter ED06 RN26, Sección 12.1; SERA.5001 Tabla S5-1"
      ]
    },
    "metadata": {
      "difficulty": 0.6
    }
  }
]